Tag_Name,Descr,Tag_Values
Respondent_Type,Multiselect,"Admin, Consumer, ECP, HCP, Nursing Staff, Patient"
QNR_Country,Multiselect,"Canada, EU, France, India, Japan, UK, US"
Pricing,Multiselect,"Gabor Granger, Van Westendorp"
QNR_Industry,Multiselect,"Consumer Electronics, Consumer Goods, Healthcare, MedTech, Medical Devices, Vision Care"
QNR_Sections,Yes/No for each section,"Additional Questions, Brand/Product Awareness & Usage, Concept exposure, Feature Priotitization, Methodology, QC, Sample Plan, Screener"
Mandatory_Sections,Must have sections in QNR,"Additional Questions, Brand/Product Awareness & Usage, Concept exposure, Methodology, Programmer Instructions, Sample Plan, Screener"
Methodology,Multiselect,"Conjoint, Feature Importance, Pricing"
Mandatory_Logics,Must have logics in QNR,"Piping Logic, Sampling Logic, Screener Logic"